{
  "$schema": "https://json-schema.org/draft/2020-12/schema",
  "$id": "https://raw.githubusercontent.com/kuoruan/pi-mono/master/extensions/pi-permission-ai-guard/schemas/ai-guard.schema.json",
  "type": "object",
  "properties": {
    "provider": {
      "anyOf": [
        {
          "type": "string",
          "minLength": 1
        },
        {
          "type": "object",
          "properties": {
            "type": {
              "const": "typesafe"
            },
            "baseUrl": {
              "type": "string",
              "minLength": 1
            },
            "apiKey": {
              "type": "string",
              "minLength": 1
            }
          },
          "required": ["type"],
          "additionalProperties": false,
          "description": "Direct TypeSafe connection (classifier reviewer). Both baseUrl and apiKey are optional: unset values fall back to TYPESAFE_BASE_URL / TYPESAFE_API_KEY, then the SDK built-in default URL."
        }
      ]
    },
    "model": {
      "type": "string",
      "minLength": 1
    },
    "modelType": {
      "type": "string",
      "enum": ["chat", "classifier"],
      "default": "chat",
      "description": "Registry model type (string providers only): chat is a Pi chat model, classifier is a Pi built-in classifier via modelRegistry.classify. Rejected on direct typesafe connections."
    },
    "classifier": {
      "type": "object",
      "description": "Classifier verdict thresholds, read on both classifier backends (direct and registry) — pure policy, no transport knobs.",
      "properties": {
        "intentThreshold": {
          "type": "number",
          "minimum": 0,
          "maximum": 1,
          "default": 0.5,
          "description": "Intent probability at or above which the anchor counts as authorizing the action."
        },
        "riskThreshold": {
          "type": "number",
          "minimum": 0,
          "maximum": 1,
          "default": 0.5,
          "description": "Risk score at or above which the action denies; the tier follows the fixed quartile bands. Raising it widens what auto-allows in every mode."
        },
        "confidenceThreshold": {
          "type": "number",
          "minimum": 0,
          "maximum": 1,
          "default": 0.5,
          "description": "Minimum answer confidence; below it the verdict defers."
        },
        "timeoutMs": {
          "type": "integer",
          "exclusiveMinimum": 0,
          "maximum": 300000,
          "description": "Accepted for backward compatibility but ignored — set the top-level timeoutMs instead."
        }
      },
      "additionalProperties": false
    },
    "typesafe": {
      "type": "object",
      "description": "Deprecated alias of `classifier`; remove it. A file writing both keys is rejected. Thresholds still apply; `timeoutMs` is ignored.",
      "properties": {
        "intentThreshold": {
          "type": "number",
          "minimum": 0,
          "maximum": 1,
          "default": 0.5,
          "description": "Intent probability at or above which the anchor counts as authorizing the action."
        },
        "riskThreshold": {
          "type": "number",
          "minimum": 0,
          "maximum": 1,
          "default": 0.5,
          "description": "Risk score at or above which the action denies; the tier follows the fixed quartile bands. Raising it widens what auto-allows in every mode."
        },
        "confidenceThreshold": {
          "type": "number",
          "minimum": 0,
          "maximum": 1,
          "default": 0.5,
          "description": "Minimum answer confidence; below it the verdict defers."
        },
        "timeoutMs": {
          "type": "integer",
          "exclusiveMinimum": 0,
          "maximum": 300000,
          "description": "Accepted for backward compatibility but ignored — set the top-level timeoutMs instead."
        }
      },
      "additionalProperties": false,
      "deprecated": true
    },
    "fallbacks": {
      "type": "array",
      "maxItems": 5,
      "description": "Ordered backup reviewers in any lane (defaults to none). Chat-model entries use Pi registry provider/model ids; System One entries carry their own URL, key and model.",
      "items": {
        "oneOf": [
          {
            "type": "object",
            "properties": {
              "provider": {
                "type": "string",
                "minLength": 1
              },
              "model": {
                "type": "string",
                "minLength": 1
              },
              "modelType": {
                "type": "string",
                "enum": ["chat", "classifier"],
                "default": "chat"
              },
              "timeoutMs": {
                "type": "integer",
                "exclusiveMinimum": 0,
                "maximum": 300000
              }
            },
            "required": ["provider", "model"],
            "additionalProperties": false
          },
          {
            "type": "object",
            "properties": {
              "provider": {
                "type": "object",
                "properties": {
                  "type": {
                    "const": "typesafe"
                  },
                  "baseUrl": {
                    "type": "string",
                    "format": "uri"
                  },
                  "apiKey": {
                    "type": "string",
                    "minLength": 1
                  }
                },
                "required": ["type", "baseUrl", "apiKey"],
                "additionalProperties": false
              },
              "model": {
                "type": "string",
                "minLength": 1
              },
              "timeoutMs": {
                "type": "integer",
                "exclusiveMinimum": 0,
                "maximum": 300000
              }
            },
            "required": ["provider", "model"],
            "additionalProperties": false
          }
        ]
      }
    },
    "reasoning": {
      "type": "string",
      "enum": ["off", "minimal", "low", "medium", "high", "xhigh", "max"],
      "default": "off"
    },
    "timeoutMs": {
      "type": "integer",
      "exclusiveMinimum": 0,
      "maximum": 300000,
      "default": 15000
    },
    "maxTokens": {
      "type": "integer",
      "minimum": 16,
      "maximum": 32768,
      "default": 4096,
      "description": "Reviewer answer budget in tokens. With reasoning on, budget-based providers (Anthropic, Bedrock) add the thinking budget on top, while effort-based providers (OpenAI-compatible) share this cap with thinking; too small a cap truncates the reply mid-think (the empty-reply machinery failure)."
    },
    "mode": {
      "type": "string",
      "enum": ["strict", "default", "lenient", "permissive"],
      "default": "default",
      "description": "The leniency ladder for the reviewer's non-allow verdicts, strictest first. Hard-tier denies (riskLevel high|critical, or missing) always deny. Soft-tier denies (low/medium) and the model's own uncertainty (split by its lean: benign-leaned, neutral, danger-leaned) map per mode: 'strict' — everything denies, the reviewer's allow is the only pass; 'default' — you judge every flag but hard danger (soft denies and every unresolved doubt ask); 'lenient' — benign and neutral doubts pass, soft denies and danger-leaned doubts ask; 'permissive' — everything passes except hard-tier denies. Reviewer machinery failures never map to allow: they deny under strict and permissive, and defer otherwise."
    },
    "notifyLevel": {
      "type": "string",
      "enum": ["info", "warning", "error", "off"],
      "default": "info",
      "description": "The minimum ambient (review-loop) notification level that still notifies the operator; 'off' silences all ambient notices. Command feedback (the /ai-guard surface) is never gated. With denials having no host dialog, 'off' or 'warning' means model denies (and clarifications, at 'warning') reach only the agent and the audit log."
    },
    "notifyApprovals": {
      "type": "boolean",
      "default": false,
      "description": "Opt in to info-level notices when AI Guard emits an allow (fresh or cached). Fresh reviews carry their total review cost in a duration tail; cache replays say (cached). Mapped allows name the mode (`mode (permissive) auto-approved`); path and external_directory families are excluded because the host caps their allows to defer. Subject to notifyLevel; commands and targets are never shown."
    },
    "circuitBreaker": {
      "type": "object",
      "properties": {
        "consecutive": {
          "type": "integer",
          "minimum": 1,
          "maximum": 50,
          "default": 3
        },
        "total": {
          "type": "integer",
          "minimum": 1,
          "maximum": 200,
          "default": 20
        },
        "verdict": {
          "type": "string",
          "enum": ["deny", "defer"],
          "default": "deny"
        }
      },
      "additionalProperties": false
    },
    "cache": {
      "type": "object",
      "properties": {
        "maxEntries": {
          "type": "integer",
          "minimum": 0,
          "maximum": 1000,
          "default": 128
        }
      },
      "additionalProperties": false
    },
    "transcript": {
      "type": "object",
      "properties": {
        "maxUserMessages": {
          "type": "integer",
          "minimum": 1,
          "maximum": 50,
          "default": 5
        },
        "maxToolCalls": {
          "type": "integer",
          "minimum": 1,
          "maximum": 50,
          "default": 10
        },
        "maxCharsPerEntry": {
          "type": "integer",
          "minimum": 100,
          "maximum": 20000,
          "default": 1000
        }
      },
      "additionalProperties": false
    },
    "surfaces": {
      "type": "array",
      "items": {
        "type": "string",
        "minLength": 1
      },
      "default": ["bash", "mcp", "skill"]
    },
    "instructions": {
      "anyOf": [
        {
          "type": "string",
          "minLength": 1,
          "description": "Broadcast custom safety rules: the same content is appended to every lane (chat `rules`, classifier `background`)."
        },
        {
          "type": "object",
          "properties": {
            "chat": {
              "type": "object",
              "properties": {
                "rules": {
                  "type": "string",
                  "minLength": 1
                },
                "replace": {
                  "type": "boolean",
                  "default": false
                }
              },
              "required": ["rules"],
              "additionalProperties": false,
              "description": "Chat-lane slot: custom safety rules. `replace: true` swaps the built-in rules for them instead of appending; the verdict contract is always appended either way."
            },
            "classifier": {
              "type": "object",
              "properties": {
                "background": {
                  "description": "Shared background text or structured context appended to every question.",
                  "anyOf": [
                    {
                      "type": "string",
                      "minLength": 1
                    },
                    {
                      "type": "object"
                    },
                    {
                      "type": "array"
                    }
                  ]
                },
                "questions": {
                  "type": "object",
                  "description": "Per-question additions keyed by question id.",
                  "propertyNames": {
                    "enum": ["danger_category", "intent_match", "risk"]
                  },
                  "additionalProperties": {
                    "anyOf": [
                      {
                        "type": "string",
                        "minLength": 1
                      },
                      {
                        "type": "object"
                      },
                      {
                        "type": "array"
                      }
                    ]
                  }
                }
              },
              "additionalProperties": false,
              "description": "Classifier-lane slot (append-only): shared background plus per-question additions keyed by stable question id (danger_category, intent_match, risk). The built-in reviewer background, questions, and criteria are the answer contract the verdict thresholds are calibrated against, so nothing here replaces them."
            }
          },
          "additionalProperties": false,
          "description": "Per-lane slots. A lane without a slot runs the built-in instructions; a slot whose lane no configured reviewer declares is rejected. A lane declared only by a fallback can still go unused if that fallback is later skipped — the loader reports it."
        },
        {
          "type": "null"
        }
      ],
      "default": null
    }
  },
  "required": ["provider", "model"],
  "additionalProperties": false
}
